{
  "$schema": "https://json-schema.org/draft/2020-12/schema",
  "$id": "https://calendar.local/schemas/trip.schema.json",
  "title": "Calendar Trip",
  "description": "Calendarが変換なしで表示する完全な旅行JSON。値がない任意情報はキーを省略せずnullまたは空配列にする。",
  "$ref": "#/$defs/trip",
  "$defs": {
    "id": { "type": "string", "pattern": "^[A-Za-z0-9][A-Za-z0-9_-]{0,99}$" },
    "date": { "type": "string", "pattern": "^[0-9]{4}-[0-9]{2}-[0-9]{2}$" },
    "clock": { "type": ["string", "null"], "pattern": "^([01][0-9]|2[0-3]):[0-5][0-9]$" },
    "nullableString": { "type": ["string", "null"] },
    "time": {
      "type": "object",
      "additionalProperties": false,
      "required": ["mode", "start", "end", "durationMinutes"],
      "properties": {
        "mode": { "enum": ["fixed", "range", "undecided", "none"] },
        "start": { "$ref": "#/$defs/clock" },
        "end": { "$ref": "#/$defs/clock" },
        "durationMinutes": { "type": ["integer", "null"], "minimum": 1 }
      }
    },
    "placeSelection": {
      "type": "object",
      "additionalProperties": false,
      "required": ["candidatePlaceIds", "selection", "minSelections", "maxSelections"],
      "properties": {
        "candidatePlaceIds": { "type": "array", "minItems": 0, "uniqueItems": true, "items": { "$ref": "#/$defs/id" } },
        "selection": { "type": "array", "uniqueItems": true, "items": { "$ref": "#/$defs/id" } },
        "minSelections": { "type": ["integer", "null"], "minimum": 0 },
        "maxSelections": { "type": ["integer", "null"], "minimum": 1 }
      }
    },
    "scheduleItem": {
      "type": "object",
      "additionalProperties": false,
      "required": ["id", "dayId", "order", "status", "action", "category", "summary", "details", "time", "placeSelection"],
      "properties": {
        "id": { "$ref": "#/$defs/id" },
        "dayId": { "$ref": "#/$defs/id" },
        "order": { "type": "integer", "minimum": 0 },
        "status": { "enum": ["confirmed", "tentative", "undecided"] },
        "action": { "type": "string", "minLength": 1 },
        "candidateJudgments": { "type": "object", "additionalProperties": { "enum": ["ok", "ng"] } },
        "searchQuery": { "type": "string", "minLength": 1, "maxLength": 500 },
        "mapPlaceId": { "description": "Optional map display target. Omit for normal selection/candidates, null to hide this schedule on map, or reference an existing Place to group the visit there.", "anyOf": [{ "$ref": "#/$defs/id" }, { "type": "null" }] },
        "category": { "enum": ["sightseeing", "food", "accommodation", "other"] },
        "summary": { "$ref": "#/$defs/nullableString" },
        "details": { "type": "array", "items": { "type": "string", "minLength": 1 } },
        "importantComment": { "$ref": "#/$defs/nullableString" },
        "time": { "$ref": "#/$defs/time" },
        "placeSelection": { "$ref": "#/$defs/placeSelection" }
      }
    },
    "day": {
      "type": "object",
      "additionalProperties": false,
      "required": ["id", "date", "title", "routeSummary", "scheduleItems", "transportIds"],
      "properties": {
        "id": { "$ref": "#/$defs/id" },
        "date": { "$ref": "#/$defs/date" },
        "title": { "type": "string", "minLength": 1 },
        "areas": { "type": "array", "items": { "type": "object", "additionalProperties": false, "required": ["name", "location"], "properties": { "name": { "type": "string", "minLength": 1 }, "googlePlaceId": { "type": ["string", "null"], "minLength": 1 }, "location": { "$ref": "#/$defs/location" } } } },
        "routeSummary": { "$ref": "#/$defs/nullableString" },
        "scheduleItems": { "type": "array", "items": { "$ref": "#/$defs/scheduleItem" } },
        "transportIds": { "type": "array", "uniqueItems": true, "items": { "$ref": "#/$defs/id" } }
      }
    },
    "transport": {
      "type": "object",
      "additionalProperties": false,
      "required": ["id", "dayId", "order", "status", "mode", "fromPlaceId", "toPlaceId", "time", "bookingId"],
      "properties": {
        "id": { "$ref": "#/$defs/id" },
        "dayId": { "$ref": "#/$defs/id" },
        "order": { "type": "integer", "minimum": 0 },
        "status": { "enum": ["confirmed", "tentative", "undecided"] },
        "important": { "type": "boolean" },
        "showOnMap": { "type": "boolean", "description": "Explicitly selected inter-area route; omitted means false. Railway shapes are stored separately as derived data." },
        "mode": { "enum": ["walk", "train", "shinkansen", "bus", "car", "ferry", "flight", "other"] },
        "railRoute": { "anyOf": [{ "$ref": "#/$defs/railRoute" }, { "type": "null" }] },
        "serviceName": { "$ref": "#/$defs/nullableString" },
        "fromPlaceId": { "$ref": "#/$defs/id" },
        "toPlaceId": { "$ref": "#/$defs/id" },
        "importantComment": { "$ref": "#/$defs/nullableString" },
        "time": { "$ref": "#/$defs/time" },
        "bookingId": { "anyOf": [{ "$ref": "#/$defs/id" }, { "type": "null" }] }
      }
    },
    "railRoute": {
      "type": "object", "additionalProperties": false, "required": ["legs"],
      "properties": {
        "legs": {
          "type": "array", "minItems": 1,
          "items": {
            "type": "object", "additionalProperties": false,
            "required": ["operator", "line", "from", "to"],
            "properties": {
              "operator": { "type": "string", "minLength": 1 },
              "line": { "type": "string", "minLength": 1 },
              "from": { "type": "string", "minLength": 1 },
              "to": { "type": "string", "minLength": 1 },
              "via": { "type": "array", "items": { "type": "string", "minLength": 1 } }
            }
          }
        }
      }
    },
    "location": {
      "type": ["object", "null"],
      "additionalProperties": false,
      "required": ["latitude", "longitude"],
      "properties": {
        "latitude": { "type": "number", "minimum": -90, "maximum": 90 },
        "longitude": { "type": "number", "minimum": -180, "maximum": 180 }
      }
    },
    "rating": {
      "type": ["object", "null"],
      "additionalProperties": false,
      "required": ["value", "source", "observedAt"],
      "properties": {
        "value": { "type": "number", "minimum": 0, "maximum": 5 },
        "source": { "enum": ["食べログ", "楽天トラベル"] },
        "observedAt": { "$ref": "#/$defs/date" }
      }
    },
    "place": {
      "type": "object",
      "additionalProperties": false,
      "required": ["id", "name", "summary", "category", "address", "location", "urls", "rating"],
      "properties": {
        "id": { "$ref": "#/$defs/id" },
        "name": { "type": "string", "minLength": 1 },
        "summary": { "$ref": "#/$defs/nullableString" },
        "category": { "enum": ["restaurant", "hotel", "station", "attraction", "other"] },
        "address": { "$ref": "#/$defs/nullableString" },
        "mapDisplayName": { "type": ["string", "null"] },
        "googlePlaceId": { "type": ["string", "null"], "minLength": 1 }, "location": { "$ref": "#/$defs/location" },
        "officialUrl": { "type": ["string", "null"], "pattern": "^https://" },
        "urls": { "type": "array", "uniqueItems": true, "items": { "type": "string", "pattern": "^https://" } },
        "rating": { "$ref": "#/$defs/rating" }
      }
    },
    "preparationTask": {
      "type": "object",
      "additionalProperties": false,
      "required": ["id", "label", "dueDate", "completed", "order"],
      "properties": {
        "id": { "$ref": "#/$defs/id" },
        "label": { "type": "string", "minLength": 1 },
        "dueDate": { "$ref": "#/$defs/date" },
        "completed": { "type": "boolean" },
        "order": { "type": "integer", "minimum": 0 }
      }
    },
    "preparation": {
      "type": "object",
      "additionalProperties": false,
      "required": ["id", "tasks"],
      "properties": {
        "id": { "$ref": "#/$defs/id" },
        "tasks": { "type": "array", "items": { "$ref": "#/$defs/preparationTask" } }
      }
    },
    "packingItem": {
      "type": "object",
      "additionalProperties": false,
      "required": ["id", "label", "completed", "notNeeded", "order"],
      "properties": {
        "id": { "$ref": "#/$defs/id" },
        "label": { "type": "string", "minLength": 1 },
        "completed": { "type": "boolean" },
        "notNeeded": { "type": "boolean" },
        "order": { "type": "integer", "minimum": 0 }
      }
    },
    "rioPlan": {
      "type": "object",
      "additionalProperties": false,
      "required": ["id", "applicable", "careMode", "careDecisionDueDate", "careDetails", "packingTemplate", "packingItems"],
      "properties": {
        "id": { "$ref": "#/$defs/id" },
        "applicable": { "type": "boolean" },
        "careMode": { "enum": ["accompany", "leave", "undecided", "not_applicable"] },
        "careDecisionDueDate": { "anyOf": [{ "$ref": "#/$defs/date" }, { "type": "null" }] },
        "careDetails": { "$ref": "#/$defs/nullableString" },
        "packingTemplate": { "$ref": "#/$defs/nullableString" },
        "packingItems": { "type": "array", "items": { "$ref": "#/$defs/packingItem" } }
      }
    },
    "booking": {
      "type": "object",
      "additionalProperties": false,
      "required": ["id", "category", "status", "targetDate", "placeId", "transportId", "label", "amount", "currency", "notes"],
      "properties": {
        "id": { "$ref": "#/$defs/id" },
        "category": { "enum": ["accommodation", "transport", "activity", "other"] },
        "status": { "enum": ["pending", "booked", "change_required", "cancelled"] },
        "targetDate": { "$ref": "#/$defs/date" },
        "placeId": { "anyOf": [{ "$ref": "#/$defs/id" }, { "type": "null" }] },
        "transportId": { "anyOf": [{ "$ref": "#/$defs/id" }, { "type": "null" }] },
        "label": { "$ref": "#/$defs/nullableString" },
        "amount": { "type": ["integer", "null"], "minimum": 0 },
        "currency": { "type": "string", "pattern": "^[A-Z]{3}$" },
        "notes": { "$ref": "#/$defs/nullableString" }
      }
    },
    "trip": {
      "type": "object",
      "additionalProperties": false,
      "required": ["id", "title", "dateRange", "summary", "days", "places", "transports", "preparation", "rioPlan", "bookings"],
      "properties": {
        "id": { "$ref": "#/$defs/id" },
        "title": { "type": "string", "minLength": 1 },
        "photoAlbumName": { "type": "string", "minLength": 1 },
        "dateRange": {
          "type": "object",
          "additionalProperties": false,
          "required": ["start", "end"],
          "properties": { "start": { "$ref": "#/$defs/date" }, "end": { "$ref": "#/$defs/date" } }
        },
        "summary": { "$ref": "#/$defs/nullableString" },
        "days": { "type": "array", "minItems": 1, "items": { "$ref": "#/$defs/day" } },
        "places": { "type": "array", "items": { "$ref": "#/$defs/place" } },
        "transports": { "type": "array", "items": { "$ref": "#/$defs/transport" } },
        "preparation": { "$ref": "#/$defs/preparation" },
        "rioPlan": { "$ref": "#/$defs/rioPlan" },
        "bookings": { "type": "array", "items": { "$ref": "#/$defs/booking" } }
      }
    }
  }
}
