{
  "id": "hokkaido-import-review",
  "title": "札幌・小樽4日間（新規取込の合成確認）",
  "dateRange": {
    "start": "2027-06-12",
    "end": "2027-06-15"
  },
  "summary": "2027年6月12〜15日、札幌3泊の合成入力。宿泊bookedと日時はテスト上の指定で、実予約ではない。鉄道ダイヤ・空室・料金は未確認。航空便は未指定。施設情報は2026-09-10確認。",
  "days": [
    {
      "id": "day-1",
      "date": "2027-06-12",
      "title": "到着して札幌で休む",
      "routeSummary": "新千歳空港→札幌",
      "scheduleItems": [
        {
          "id": "dinner-1",
          "dayId": "day-1",
          "order": 1,
          "status": "undecided",
          "action": "札幌で夕食をとる",
          "category": "food",
          "summary": "店と時刻は未定。移動・観光の前後に余裕を取る。",
          "details": [],
          "time": {
            "mode": "undecided",
            "start": null,
            "end": null,
            "durationMinutes": null
          },
          "placeSelection": {
            "candidatePlaceIds": [],
            "selection": [],
            "minSelections": null,
            "maxSelections": null
          },
          "searchQuery": "札幌駅周辺で到着後に夕食。営業時刻を確認して選ぶ"
        },
        {
          "id": "stay-1",
          "dayId": "day-1",
          "order": 2,
          "status": "confirmed",
          "action": "JRタワーホテル日航札幌に宿泊",
          "category": "accommodation",
          "summary": "合成入力では3泊を予約済みと指定。実予約ではない。",
          "details": [],
          "time": {
            "mode": "fixed",
            "start": "18:00",
            "end": null,
            "durationMinutes": null
          },
          "placeSelection": {
            "candidatePlaceIds": [
              "hotel"
            ],
            "selection": [
              "hotel"
            ],
            "minSelections": null,
            "maxSelections": 1
          }
        }
      ],
      "transportIds": [
        "arrival"
      ]
    },
    {
      "id": "day-2",
      "date": "2027-06-13",
      "title": "小樽の歴史を訪ねる",
      "routeSummary": "札幌→小樽→札幌",
      "scheduleItems": [
        {
          "id": "breakfast-2",
          "dayId": "day-2",
          "order": 0,
          "status": "undecided",
          "action": "札幌で朝食をとる",
          "category": "food",
          "summary": "店と時刻は未定。移動・観光の前後に余裕を取る。",
          "details": [],
          "time": {
            "mode": "undecided",
            "start": null,
            "end": null,
            "durationMinutes": null
          },
          "placeSelection": {
            "candidatePlaceIds": [],
            "selection": [],
            "minSelections": null,
            "maxSelections": null
          },
          "searchQuery": "札幌駅周辺または宿泊先で朝食"
        },
        {
          "id": "visit-museum",
          "dayId": "day-2",
          "order": 3,
          "status": "confirmed",
          "action": "小樽市総合博物館 運河館で地域の歴史展示を見る",
          "category": "sightseeing",
          "summary": "訪問を指定した合成入力。営業日は実旅行決定時に再確認。",
          "details": [],
          "time": {
            "mode": "range",
            "start": "10:00",
            "end": "11:30",
            "durationMinutes": 90
          },
          "placeSelection": {
            "candidatePlaceIds": [
              "museum"
            ],
            "selection": [
              "museum"
            ],
            "minSelections": null,
            "maxSelections": 1
          }
        },
        {
          "id": "lunch-2",
          "dayId": "day-2",
          "order": 4,
          "status": "undecided",
          "action": "小樽で昼食をとる",
          "category": "food",
          "summary": "店と時刻は未定。移動・観光の前後に余裕を取る。",
          "details": [],
          "time": {
            "mode": "undecided",
            "start": null,
            "end": null,
            "durationMinutes": null
          },
          "placeSelection": {
            "candidatePlaceIds": [],
            "selection": [],
            "minSelections": null,
            "maxSelections": null
          },
          "searchQuery": "小樽の運河周辺で昼食。混雑に応じて選ぶ"
        },
        {
          "id": "dinner-2",
          "dayId": "day-2",
          "order": 7,
          "status": "undecided",
          "action": "札幌で夕食をとる",
          "category": "food",
          "summary": "店と時刻は未定。移動・観光の前後に余裕を取る。",
          "details": [],
          "time": {
            "mode": "undecided",
            "start": null,
            "end": null,
            "durationMinutes": null
          },
          "placeSelection": {
            "candidatePlaceIds": [],
            "selection": [],
            "minSelections": null,
            "maxSelections": null
          },
          "searchQuery": "札幌駅周辺で夕食"
        },
        {
          "id": "stay-2",
          "dayId": "day-2",
          "order": 8,
          "status": "confirmed",
          "action": "JRタワーホテル日航札幌に宿泊",
          "category": "accommodation",
          "summary": "合成入力では3泊を予約済みと指定。実予約ではない。",
          "details": [],
          "time": {
            "mode": "undecided",
            "start": null,
            "end": null,
            "durationMinutes": null
          },
          "placeSelection": {
            "candidatePlaceIds": [
              "hotel"
            ],
            "selection": [
              "hotel"
            ],
            "minSelections": null,
            "maxSelections": 1
          }
        }
      ],
      "transportIds": [
        "to-otaru",
        "walk-museum",
        "walk-back",
        "from-otaru"
      ]
    },
    {
      "id": "day-3",
      "date": "2027-06-14",
      "title": "札幌中心部をゆっくり楽しむ",
      "routeSummary": "札幌",
      "scheduleItems": [
        {
          "id": "breakfast-3",
          "dayId": "day-3",
          "order": 0,
          "status": "undecided",
          "action": "札幌で朝食をとる",
          "category": "food",
          "summary": "店と時刻は未定。移動・観光の前後に余裕を取る。",
          "details": [],
          "time": {
            "mode": "undecided",
            "start": null,
            "end": null,
            "durationMinutes": null
          },
          "placeSelection": {
            "candidatePlaceIds": [],
            "selection": [],
            "minSelections": null,
            "maxSelections": null
          },
          "searchQuery": "宿泊先または札幌駅周辺で朝食"
        },
        {
          "id": "city-choice",
          "dayId": "day-3",
          "order": 1,
          "status": "tentative",
          "action": "札幌で名所を楽しむ",
          "category": "sightseeing",
          "summary": "時計台と大通公園から1か所を選ぶ案。両方を訪問確定にせず、市内移動も選択後に決める。",
          "details": [],
          "time": {
            "mode": "fixed",
            "start": "10:00",
            "end": "11:00",
            "durationMinutes": null
          },
          "placeSelection": {
            "candidatePlaceIds": [
              "clock",
              "odori"
            ],
            "selection": [],
            "minSelections": null,
            "maxSelections": 1
          },
          "searchQuery": "札幌中心部で天候と気分に応じて1か所選ぶ"
        },
        {
          "id": "lunch-3",
          "dayId": "day-3",
          "order": 2,
          "status": "undecided",
          "action": "札幌で昼食をとる",
          "category": "food",
          "summary": "店と時刻は未定。移動・観光の前後に余裕を取る。",
          "details": [],
          "time": {
            "mode": "undecided",
            "start": null,
            "end": null,
            "durationMinutes": null
          },
          "placeSelection": {
            "candidatePlaceIds": [],
            "selection": [],
            "minSelections": null,
            "maxSelections": null
          },
          "searchQuery": "選んだ札幌中心部の観光先近くで昼食"
        },
        {
          "id": "dinner-3",
          "dayId": "day-3",
          "order": 3,
          "status": "undecided",
          "action": "札幌で夕食をとる",
          "category": "food",
          "summary": "店と時刻は未定。移動・観光の前後に余裕を取る。",
          "details": [],
          "time": {
            "mode": "undecided",
            "start": null,
            "end": null,
            "durationMinutes": null
          },
          "placeSelection": {
            "candidatePlaceIds": [],
            "selection": [],
            "minSelections": null,
            "maxSelections": null
          },
          "searchQuery": "札幌駅周辺で夕食"
        },
        {
          "id": "stay-3",
          "dayId": "day-3",
          "order": 4,
          "status": "confirmed",
          "action": "JRタワーホテル日航札幌に宿泊",
          "category": "accommodation",
          "summary": "合成入力では3泊を予約済みと指定。実予約ではない。",
          "details": [],
          "time": {
            "mode": "undecided",
            "start": null,
            "end": null,
            "durationMinutes": null
          },
          "placeSelection": {
            "candidatePlaceIds": [
              "hotel"
            ],
            "selection": [
              "hotel"
            ],
            "minSelections": null,
            "maxSelections": 1
          }
        }
      ],
      "transportIds": []
    },
    {
      "id": "day-4",
      "date": "2027-06-15",
      "title": "帰路に備えて空港へ向かう",
      "routeSummary": "札幌→新千歳空港",
      "scheduleItems": [
        {
          "id": "breakfast-4",
          "dayId": "day-4",
          "order": 0,
          "status": "undecided",
          "action": "札幌で朝食をとる",
          "category": "food",
          "summary": "店と時刻は未定。移動・観光の前後に余裕を取る。",
          "details": [],
          "time": {
            "mode": "undecided",
            "start": null,
            "end": null,
            "durationMinutes": null
          },
          "placeSelection": {
            "candidatePlaceIds": [],
            "selection": [],
            "minSelections": null,
            "maxSelections": null
          },
          "searchQuery": "宿泊先または札幌駅周辺で朝食"
        },
        {
          "id": "souvenir",
          "dayId": "day-4",
          "order": 1,
          "status": "tentative",
          "action": "札幌駅でお土産を選ぶ",
          "category": "sightseeing",
          "summary": "空港への移動前。航空便決定後に余裕を確保する。",
          "details": [],
          "time": {